{
  "id": "EventStatus",
  "description": "A service providing resources providing status' on events subscribed by workers.",
  "service": {
    "readOnly": false,
    "routerBase": "/event/status/"
  },
  "target": {
    "indexes": [
      "eventName",
      "status.status,status.workerId",
      "information.workerId,information.content",
      "eventResource.ref.$id,tenant",
      "createDate[\"expireAfterSeconds\"=7257600,\"sparse\"=true]"
    ],
    "relations": [],
    "fields": [
      {
        "name": "id",
        "type": "varchar",
        "title": "ID",
        "description": "Unique identifier"
      },
      {
        "name": "createDate",
        "type": "datetime",
        "title": "Creation date",
        "description": "Creation date",
        "readOnly": true
      },
      {
        "name": "eventName",
        "type": "varchar",
        "title": "Event Name",
        "description": "Name of the created event",
        "readOnly": true,
        "searchable": 1
      },
      {
        "name": "userId",
        "type": "varchar",
        "title": "User Identifier",
        "description": "User who created the event entry",
        "readOnly": true
      },
      {
        "name": "eventResource.ref",
        "type": "extref",
        "exposeAs": "$ref",
        "title": "Ref to event resource",
        "collection": ["*"],
        "description": "A $ref pointing to the resource that triggered this event. If the resource was deleted, it may not exist anymore.",
        "required": false
      },
      {
        "name": "status.0.workerId",
        "type": "string",
        "title": "Worker ID",
        "description": "ID of a worker",
        "required": true
      },
      {
        "name": "status.0.status",
        "type": "string",
        "title": "Status",
        "description": "A string representing the status (opened, working, failed, done)",
        "required": true,
        "constraints": [
          {
            "name": "Choice",
            "options": [
              {"name": "choices", "value": "opened|working|ignored|done|failed"}
            ]
          }
        ]
      },
      {
        "name": "status.0.action.ref",
        "type": "extref",
        "title": "Action",
        "exposeAs": "$ref",
        "description": "Action done for this event, EventWorkerAction",
        "collection": [
          "EventStatusAction"
        ],
        "required": false
      },
      {
        "name": "information",
        "type": "hash",
        "title": "Information",
        "description": "An array of objects containing worker information",
        "required": false
      },
      {
        "name": "information.0.workerId",
        "type": "string",
        "title": "Worker ID",
        "description": "ID of a worker",
        "required": true
      },
      {
        "name": "information.0.type",
        "type": "string",
        "title": "Information type",
        "description": "The type of information the worker published",
        "required": true,
        "constraints": [
          {
            "name": "Choice",
            "options": [
              {"name": "choices", "value": "debug|info|warning|error"}
            ]
          }
        ]
      },
      {
        "name": "information.0.content",
        "type": "string",
        "title": "Worker output",
        "description": "A place where a worker can put any information content",
        "required": true
      },
      {
        "name": "information.0.ref",
        "type": "string",
        "exposeAs": "$ref",
        "title": "Ref",
        "collection": ["*"],
        "description": "An optional $ref that can be written by the worker",
        "required": false
      }
    ]
  }
}
